{
  "$schema": "https://json-schema.org/draft/2020-12/schema",
  "$id": "https://example.invalid/schemas/evidence.schema.json",
  "$ref": "#/$defs/Evidence",
  "$defs": {
    "Evidence": {
      "type": "object",
      "properties": {
        "id": {
          "$ref": "#/$defs/EvidenceId"
        },
        "documentId": {
          "type": "string",
          "minLength": 1
        },
        "documentTitle": {
          "type": "string",
          "minLength": 1
        },
        "section": {
          "type": "string",
          "minLength": 1
        },
        "text": {
          "type": "string",
          "minLength": 1
        },
        "url": {
          "type": "string",
          "format": "uri"
        },
        "updatedAt": {
          "type": "string",
          "format": "date-time",
          "pattern": "^(?:(?:\\d\\d[2468][048]|\\d\\d[13579][26]|\\d\\d0[48]|[02468][048]00|[13579][26]00)-02-29|\\d{4}-(?:(?:0[13578]|1[02])-(?:0[1-9]|[12]\\d|3[01])|(?:0[469]|11)-(?:0[1-9]|[12]\\d|30)|(?:02)-(?:0[1-9]|1\\d|2[0-8])))T(?:(?:[01]\\d|2[0-3]):[0-5]\\d:[0-5]\\d(?:\\.\\d+)?(?:Z|([+-](?:[01]\\d|2[0-3]):[0-5]\\d)))$"
        },
        "retrievalScore": {
          "type": "number"
        },
        "rerankScore": {
          "type": "number"
        },
        "metadata": {
          "$ref": "#/$defs/EvidenceMetadata"
        }
      },
      "required": [
        "id",
        "documentId",
        "documentTitle",
        "text",
        "retrievalScore",
        "metadata"
      ],
      "additionalProperties": false,
      "title": "Evidence",
      "description": "An immutable, addressable corpus excerpt with source metadata and scores."
    },
    "EvidenceId": {
      "type": "string",
      "minLength": 1,
      "pattern": "^[a-z0-9][a-z0-9._/-]*#[a-z0-9][a-z0-9-]*#\\d+-[0-9a-f]{8}$",
      "description": "Stable, addressable identifier for a corpus chunk."
    },
    "EvidenceMetadata": {
      "type": "object",
      "properties": {
        "author": {
          "type": "string",
          "minLength": 1
        },
        "version": {
          "type": "string",
          "minLength": 1
        },
        "category": {
          "type": "string",
          "minLength": 1
        }
      },
      "additionalProperties": false
    }
  }
}
